{
  "releaseId": "release-surface-002",
  "tenantId": "tenant-example",
  "projectId": "surface-example",
  "correlationId": "correlation-002",
  "environment": "staging",
  "graphReferences": [],
  "generatedOutputs": [],
  "semanticGates": [],
  "requirements": {
    "profileId": "https://example.test/profiles/default",
    "profileRevisionHash": "sha256:dddddddddddddddddddddddddddddddddddddddddddddddddddddddddddddddd",
    "canonicalisationVersion": "srf-canon/1",
    "approvalEvidenceDigest": "sha256:eeeeeeeeeeeeeeeeeeeeeeeeeeeeeeeeeeeeeeeeeeeeeeeeeeeeeeeeeeeeeeee",
    "impactEvidenceDigest": "sha256:ffffffffffffffffffffffffffffffffffffffffffffffffffffffffffffffff"
  },
  "retentionClass": "standard",
  "legalHold": false
}
